[
  {
    "date": "2025-12-31",
    "title": "Serav1 yeni arayüz iskeleti hazır",
    "summary": "Genel Bakış/Zoneler/Kontrol sayfaları USE_NEW_UI ile açılabiliyor.",
    "details": [
      "Yeni navigasyon yapısı (Genel Bakış, Zoneler, Kontrol) beta olarak eklendi.",
      "Zon kartları sensör/aktüatör özetlerini gösterir.",
      "Node ve otomasyon özetleri Genel Bakış sayfasında görünür.",
      "Kontrol sayfası zon odaklı gruplandı, rol/backend bilgileri öne çıktı.",
      "ESP32 PWM destekli aktüatörler için parlaklık kontrolü eklendi; pompa/ısıtıcı için onay istendi.",
      "Kontrol kartlarında otomasyon override/blok durumu özetlenir.",
      "Override iptal aksiyonu ile otomasyon tekrar devreye alınabilir.",
      "Zon kartları son aksiyon ve aktif aktüatörleri gösterir.",
      "ESP32 aktüatör kartlarında node sağlık bilgisi görünür.",
      "Kontrol banner’da node uyarıları listelenir.",
      "Genel Bakış otomasyon özeti (lux/fan/ısıtıcı/pompa) eklendi.",
      "Genel Bakış node sağlık özeti rozetleri eklendi.",
      "Node rozetlerine tıklayınca liste filtrelenir.",
      "Node rozetlerinde Tümü filtresi eklendi.",
      "Genel Bakış node listesinde son IP bilgisi gösterilir.",
      "Genel Bakış node listesinde firmware bilgisi gösterilir.",
      "Genel Bakış node listesinde son snapshot zamanı gösterilir.",
      "Genel Bakış node listesinde kamera desteği işaretlenir.",
      "Genel Bakış node rozetlerinde kamera filtresi eklendi.",
      "Zon kartlarına mini trend (son 6 saat) eklendi.",
      "Kontrol sayfasında zon başlıklarına sensör özeti ve sensör durumu eklendi.",
      "Geçmiş/Kayıtlar sayfası Serav1 görünümüne taşındı.",
      "Geçmiş sayfasına trend grafikleri eklendi (sıcaklık/nem/lux/toprak).",
      "Geçmiş sayfasına olay günlüğü (automation/manuel/uyarı) eklendi.",
      "Geçmiş trendleri zon seçimiyle telemetri verisinden okunuyor.",
      "Geçmiş olay günlüğüne kategori/seviye filtreleri eklendi.",
      "Ayarlar sayfası Serav1 görünümüne geçti.",
      "Ayarlar sayfasına özet kartı eklendi (SAFE MODE, otomasyon, bildirim, retention).",
      "Genel Bakış sayfasına son 24 saat özet kartı eklendi.",
      "Genel Bakış özet kartında veri kaynağı (telemetri/log) gösteriliyor.",
      "Genel Bakış özet kartına 6s/24s/7g aralık seçici eklendi.",
      "Geçmiş olay günlüğüne zaman aralığı filtresi eklendi.",
      "Genel Bakış özet kartına zon seçici eklendi.",
      "Genel Bakış özet kartına CSV indirme eklendi.",
      "Geçmiş grafiğine min/max/son rozetleri eklendi.",
      "Ayarlar sayfasında bölüm başlıkları sadeleştirildi.",
      "Yardım ve Güncellemeler sayfaları Serav1 görünümüne taşındı.",
      "Günlük ve haftalık rapor sayfaları Serav1 görünümüne taşındı.",
      "Donanım/LCD/Notlar sayfaları Serav1 görünümüne taşındı.",
      "Serav1 menüsüne Diğer bölümü eklendi (raporlar, yardım, güncellemeler, donanım, LCD, notlar).",
      "Yardım/SSS metinleri Serav1 sayfa adlarıyla uyumlu hale getirildi.",
      "Serav1 icin Diğer sayfasi eklendi; ek sayfalara hizli erisim saglar.",
      "Diğer sayfasi metinleri Turkce hale getirildi.",
      "Serav1 mobil alt menu sade; Ayarlar artik Diğer icinde.",
      "Mobilde Diğer sekmesi, raporlar ve ayarlar gibi alt sayfalarda aktif gosterilir.",
      "Geçmiş sayfasina rapor kisa yollari eklendi.",
      "Zoneler sayfasi aciklamasi, trend/olaylarin Geçmiş'te oldugunu netlestirir.",
      "Yardim/SSS metinleri Geçmiş/Donanim adlariyla uyumlu hale getirildi.",
      "Raporlarda Geçmiş kisa yolu eklendi.",
      "Diğer menusundeki Notlar etiketi Turkcelestirildi.",
      "Serav1 menu etiketleri Turkcelestirildi (Genel Bakis/Zoneler/Kontrol/Gecmis/Ayarlar/Diger/Yardim).",
      "Genel Bakış/Zoneler metinleri Turkcelestirildi (Katalog, Veri Yasi, Zon odakli).",
      "Zon secimleri icin erisilebilirlik etiketleri eklendi.",
      "Geçmiş sayfasında log ifadesi kayıt olarak sadeleştirildi.",
      "Olay gunlugu etiketleri Turkcelestirildi.",
      "Node durum rozetlerinde Missing/Error/Unknown etiketleri Turkcelestirildi.",
      "Node filtre rozetleri klavye ile secilebilir hale getirildi.",
      "Geçmiş tablosunda Soil sütunları Toprak olarak adlandırıldı.",
      "Genel Bakış özetinde Log etiketi Kayıt olarak güncellendi.",
      "Yardım metinlerinde log ifadeleri kayıt terminolojisine uyarlandı.",
      "Özet ve Geçmiş aralık butonlarının erişilebilirlik durumu netleştirildi.",
      "Kayıt temizleme onay metni log yerine kayıt terminolojisiyle uyumlu.",
      "Node listesinde fw/snap kısaltmaları Türkçe etiketlerle gösteriliyor.",
      "Override ifadeleri arayüzde müdahale olarak güncellendi.",
      "Yardım sayfasındaki override açıklaması müdahale olarak güncellendi.",
      "Katalog kaynağı etiketi Eski/Katalog olarak güncellendi.",
      "Veri gecikmesi ifadesi Veri yaşı olarak güncellendi.",
      "Geçmiş tablosundaki Ts başlığı Zaman olarak güncellendi.",
      "Ayarlar özetindeki Retention ifadesi Veri Saklama olarak güncellendi.",
      "Veri Saklama alanlarında log ifadeleri kayıt olarak güncellendi.",
      "Sayfa ust basliklarindaki Serav1 etiketi kaldirildi.",
      "Zon kartlarinda varsayilan baslik metni Turkcelestirildi."
    ]
  },
  {
    "date": "2025-12-30",
    "title": "ESP32 node entegrasyonu güçlendirildi",
    "summary": "Telemetri ve uzaktan aktüatör yönetimi daha güvenli hale geldi.",
    "details": [
      "ESP32 telemetri ve komut kuyruğu uçları eklendi, durumlar panelde izlenebilir.",
      "SAFE MODE ve acil durdurma uzaktan aktüatörleri de güvenli şekilde kapatır.",
      "Uzak sensör/aktüatör durumları artık API üzerinden raporlanır.",
      "SAFE MODE açıkken node komutları gönderilmez ve kuyruklar temizlenir."
    ]
  },
  {
    "date": "2025-12-30",
    "title": "Bildirimler ve veri saklama ayarları eklendi",
    "summary": "Uyarıları Telegram’a gönderebilir, logların ne kadar saklanacağını panelden yönetebilirsin.",
    "details": [
      "Ayarlar sayfasına Telegram bildirim kontrolleri eklendi (test mesajı dahil).",
      "Veri saklama/temizlik ayarları eklendi (0 gün = silme kapalı).",
      "Limit/otomasyon/uyarı eşikleri artık kalıcı olarak kaydedilir.",
      "Mobil kullanım için alt hızlı menü ve aktif sayfa vurgusu eklendi.",
      "Acil durdurma/temizlik/donanım kaydet gibi riskli aksiyonlara YES onayı eklendi."
    ]
  },
  {
    "date": "2025-12-30",
    "title": "Ayar değişiklikleri daha güvenli hale getirildi",
    "summary": "Konfigürasyon dosyalarında olası hataları önceden yakalayan kontrollerle daha sorunsuz güncelleme yapabilirsin.",
    "details": [
      "Ayar dosyaları için hızlı doğrulama eklendi (yanlış ayarı erken yakalar).",
      "Geliştirme ve doğrulama adımları tek komutla çalıştırılabilir hale getirildi.",
      "Değişiklik checklist’leri ile riskli adımlar daha kontrollü ilerler."
    ]
  },
  {
    "date": "2025-12-29",
    "title": "Günlük ve haftalık raporlar eklendi",
    "summary": "Sera verilerini anlaşılır özetler ve eğitici kartlarla görebileceğin yeni rapor sayfaları hazır.",
    "details": [
      "Günlük ve haftalık rapor sayfaları açıldı (grafikler + öğretici açıklamalar).",
      "Lux/ısı/nem/VPD/yoğuşma/GDD metrikleri için TR açıklama sözlüğü var.",
      "JSON ve CSV indirme uçlarıyla dışa aktarım yapılabilir."
    ]
  },
  {
    "date": "2025-12-27",
    "title": "Kapat butonu gorunurlugu duzeltildi",
    "summary": "Kontrol ekraninda Kapat dugmesi net gorunur hale getirildi.",
    "details": [
      "Kapat butonu rengi arkaplanla uyumlu hale getirildi.",
      "Butonlar satirda daha rahat gorunur."
    ]
  },
  {
    "date": "2025-12-27",
    "title": "Kontrol ekranina sureli buton eklendi",
    "summary": "Her roleyi ac/kapat ve sureli calistirabilirsin.",
    "details": [
      "Pompa icin de Ac butonu ve sureli calistirma var.",
      "Pompa durum bilgisi kart icinde gorunur."
    ]
  },
  {
    "date": "2025-12-27",
    "title": "LCD otomatik ekran duzeni sadeleştirildi",
    "summary": "LCD satirlari sicaklik, nem, isik ve toprak bilgisini net gosterir.",
    "details": [
      "1. satir: Sicaklik ve nem",
      "2. satir: Isik ve toprak yuzdesi",
      "3. satir: DS18B20 ve toprak ham deger",
      "4. satir: Sistem durumu"
    ]
  },
  {
    "date": "2025-12-27",
    "title": "LCD kutuphanesi kuruldu",
    "summary": "LCD yazdirma icin gerekli RPLCD kutuphanesi eklendi.",
    "details": [
      "LCD komutlari artik donanima yazilabilir.",
      "LCD testi icin metin gonderilebilir."
    ]
  },
  {
    "date": "2025-12-27",
    "title": "LCD I2C adresi 0x27 olarak ayarlandi",
    "summary": "LCD adresi I2C taramasindaki cihaza gore duzeltildi.",
    "details": [
      "I2C taramasinda 0x27 gorundugu icin LCD adresi buna cekildi.",
      "LCD calismasi icin dogru adres kullanildi."
    ]
  },
  {
    "date": "2025-12-27",
    "title": "Donanim tablosuna ekle butonu geldi",
    "summary": "Donanim listesine yeni satir ekleyip kaydedebilirsin.",
    "details": [
      "Ekle butonu ile yeni roleyi forma ekleyebilirsin.",
      "Kaydet ile yeni donanim kayit olur."
    ]
  },
  {
    "date": "2025-12-27",
    "title": "Kontrol sayfasi kartlari duzeltildi",
    "summary": "Kontrol ekraninda tum roleler gorunur hale geldi.",
    "details": [
      "Sayfa disi grafik kodlari kontrol sayfasini bozmuyor.",
      "Kontrol kartlari artik duzenli yukleniyor."
    ]
  },
  {
    "date": "2025-12-27",
    "title": "Disabled sensor uyari kaydi durduruldu",
    "summary": "Disabled olan sensörler olay gunlugunde hata olarak yazilmaz.",
    "details": [
      "DS18B20 kapaliyken okuma hatasi mesaji gorunmez.",
      "Olay gunlugu gereksiz uyarilarla dolmaz."
    ]
  },
  {
    "date": "2025-12-27",
    "title": "Grafiklerde hover bilgi ve sık etiketler",
    "summary": "Grafikte gezince saat ve değer görünür, eksen etiketleri sıklaştırıldı.",
    "details": [
      "Mouse ile grafikte gezince saat:dakika ve ölçüm değeri gösterilir.",